Título Artículo,Nombre Revista Científica,Resumen,Año
Enterprise architecture of Colombian Higher Education,"Proceedings - Frontiers in Education Conference, FIE","Colombian Higher Education Enterprise Architecture is a framework for managing the system-of-systems lifecycle of Higher Education Programs. With this framework is possible to model scenarios about the government as a regulator of Higher Education services, the educational institutions as providers of higher education services and the different business and social sectors, and individual citizens as clients of higher education services. Under this perspective all the stakeholders can participate in the planning, development, transfer, use and control of all the products and services lifecycles of higher education in order to prioritize improvement alternatives and measure progress when it is moving towards excellence in training processes, research, innovation, development and knowledge transfer. CHE2A is a supportive environment for the management of higher education as a public service, which hosts the vision of 'Global Coalition Intelligent Network Services (-GIUNC-) to analyze and evaluate systematic, systemic and logistically, the characteristics of processes, outputs and outcomes and risks through key factors such as those proposed by the - GIUNC- itself, Registry of Qualification established by the Ministry of Education of Colombia or other similar factors established by national or international entities, from which, the stakeholders in the Higher Education services, interpret, evaluate, argue, propose, define, plan, implement and measure strategies, tactics and actions for improvement, innovation and development higher education programs. CHE2A is a knowledge management system that is enriched by the experience of organizations and supports innovation in higher education toward a high performance service. The approach set CHE2A does not advocate specific tools, methods or practices, but promotes a new way of thinking, to solve the great challenges of the interactions of technology, power, politics and economics made involves the general study design, complexity and systems engineering. Although these systems often exhibit behaviors systems of complex systems, however, not all complex problems fall within the scope of systems of systems. This article presents the context, perspective and use of CHE2A through its models ontological, epistemological, methodological and regulatory that allow navigate the life cycles of products and services offered by higher education institutions and all those entities benefiting from this results achieved. © 2015 IEEE.",2015
An innovation model in curriculum design for teaching engineering at universidad EAFIT,"Proceedings - Frontiers in Education Conference, FIE","Constant changes in technology pose continuous challenges for higher education institutions that are training the engineers of the future. These changes are making it necessary to adapt the curriculum in order to develop the skills needed by the XXI century engineer. Moreover, instead of thinking in a large curriculum reform at a specific moment, it is necessary to define curriculum management processes that include change as a natural component of the process. In addition to these global trends, each institution has a particular context and thus, the analysis in each institution has unique characteristics, a common methodological approach, and a reference model that can be built as long as it is flexible enough to include that context. This paper describes a model developed for curriculum management inside the School of Engineering at Universidad EAFIT - Colombia. This model includes the institutional context and is based on a process approach defined by the Business Process Management (BPM) methodology. The model uses the Burlton Hexagon as a theoretical framework to identify organizational structure, strategies, policies, infrastructure, technology tools and human capital. It is also a mechanism for specifying curricular macro processes including the global and institutional context. The proposed model is based on three pillars: (a) scientific research in education, which promotes the use of the scientific method as a strategy to ensure an approach to problems based on evidence which allows the construction of educational innovation projects, (b) education engineering focused on engineering education, which transforms the learning by developing basic, professional, and transversal skills as well as those specific for an engineer of the XXI century, and (c) interactive educational communities, both face to face and virtual, as spaces for knowledge management that support collaborative working and experience-sharing, managed by its members working together promoting initiatives to develop educational innovation projects focused on specific topics, that answer questions related to teaching and learning needs. The formulation and development of educational innovation projects are the responses to different needs identified on specific courses that are transformed into research questions. These projects aim to renew the curriculum so that it dynamically evolves based on classroom experiences. Thus, the curriculum renewal is based on critical thinking about the problems found in engineering education. The use of the scientific method and the collaborative approach enables drawing solid conclusions based on the experimental results. The model proposes the formulation and development of innovative educational projects in which scientific research applied in education aims to transform teaching, academic and administrative practices. As consequence, curricular innovations that integrate learning objects and educational, methodological and assessment strategies, are developed by an interactive learning community composed by teachers. Finally, the results obtained by applying the model in some courses in the School of Engineering of Universidad EAFIT are presented. These results include reducing the drop-out rate of students, redefining admission and graduation profiles, and micro-curricular redesign based on competences using projects, among others. © 2014 IEEE.",2015
Knowledge management in research groups of higher education institutions in Colombia,"Proceedings of the European Conference on Knowledge Management, ECKM","The aim of the paper is to propose answers to the research question: What are the variables associated with knowledge management, which are conducted by the research groups of higher education institutions -HEI- in Colombia? This problem was identified by analyzing two major tensions. First, between the socially relevant knowledge and knowledge required by the market; and second, between the social research and research oriented by science, technology and innovation. These tensions put the knowledge management, which are conducted by the research groups, at the center of analysis. The methodology used is a case study of a qualitative and descriptive type, for which interviews and analysis of the curriculum vitae of directors and members of research groups were conducted. Review of literature on knowledge management was made, and research done on this topic by HEI. The findings are shown in three groups of variables associated with knowledge management: a) the research structure: planning, resource management, openness to change, leadership, teamwork, initiative, partnership, research training and employment; b) the research process: the problem and research questions, hypotheses, methodology, analysis and interpretation of results, participation in calls, regulation, research platforms and academic production; and c) the innovation process: prospective vision, interaction with the environment, creativity and use of information technologies. The findings indicate that the knowledge management in research groups, should be redirected through institutional policies articulated to the scientific and technological development. Although research groups perform activities resulting from the model of knowledge management (socialization, outsourcing, combination, and internationalization), these are not always practiced in a conscious way; and they also have structural difficulties during the research process, hindering the transfer of knowledge. Taking into account that HEI have integrated management systems that support the research process, it still requires improving the quality of these stages of management. The usefulness of the results leads to rethink policies that guide the processes of institutional research, and redirect knowledge management that is performed from the research groups. This for to move from the structuring of research problems arising from a weak conception of knowledge, to others where sociocultural realities are the benchmark for its formulation. Also aims to consolidate knowledge management from improving academic productivity of research groups, despite the risks of productivism. This is because the productivism is characterized by the proliferation of scientific papers based on the logic of the stacking, but, not of the knowledge creation and its social relevance.. Such practices transformed the publication, which it is a byproduct of the research, in a order of itself.",2015
Factors influencing knowledge management in university' s research [Factores influyentes de la gestión del conocimiento en el contexto de la investigación universitaria],"Informacion, Cultura y Sociedad","This research is focused on which are the enabler and inhibitor factors that influence the knowledge management practices by research groups in a Colombian university. It considers also the influence of the Colombia's National System of Science, Technology and Innovation in the research groups to manage their knowledge. The methodology used in this study is based on the grounded theory. The data were collected through in depth-interviews addressed to research group's coordinators, who where selected according to different criteria to obtain diversity of contexts. The results confirm the factors identified in the literature, and besides two more factors are identified as inhibitor to knowledge management in research groups: time employed in other tasks and the quantity of persons designated to investigate. From the results obtained, and as future line of research, it is suggested to deeply study the knowledge cycle's activities, taking into account the enablers and inhibitors factors identified.",2015
Deep learning: The great challenge to innovate: Highlighting Colombia's food industry,"Proceedings of the International Conference on Intellectual Capital, Knowledge Management and Organisational Learning, ICICKM","In this century, organizations must read and understand their environment, develop compatible capabilities and transform if necessary to adapt to the new rules of the game of value and take appropriate decisions that will maintain them in the future. The ability to generate knowledge-based value not only depends on the individual company, but also depends largely on the ability to generate value of both the sector to which the company belongs and the economy of the native country. This document is the result of the analysis of the signals of the sector, second component of the preliminary stage of the DECK Study carried out by Bio Gerencia Virtual®. The main official sources of the food and beverage industry in Colombia were analyzed to detect the potential of this industry to create value by transforming knowledge into innovation. From analysis of the industry variables, signals that can become the basis for indicators are identified and propose a path of positive development for the sector: Transforming a traditional sector into one driven by knowledge. Peter M. Senge and others have referred to the deep learning cycle as the essence of the learning organization. When major changes are required, a deep learning cycle operates and can happen individually or collectively. In the Paisa Culture Prototype, a prototype of Knowledge Management for Innovation, whose base is the DECK Study, analyzes of specific sectors of the Colombian economy is included. If we understand each sector as a team able to create what it wants to create, the deep learning cycle will be relevant to each economic sector. In particular, the food and beverage industry of Colombia depends largely on the rich biodiversity of Colombia. The greatest opportunities for the sector can be found in the governmental purpose of transforming the Colombian industry. The food sector is at the center of this transformation; but, according to the findings, if the deep learning cycle is not activated, the transformation will not occur; and therefore neither will there be knowledgebased innovation. If the sector does not renew its thought model, it will not become an innovative sector. In the second part of the document, and with the representation of information of the business learning loop proposed by Haeckel and Nolan, work fronts in the sector are derived and some considerations are presented, taking into account issues of learning required to implement a traditional industry to become an innovative industry driven by knowledge. The outline of the document provides elements that are confined to the Detect Function and Interpret Function within the business learning loop. This cycle serves as a starting point to understand the deep learning cycle. It also refers to the collective learning that is perceived from the analysis that will be needed to increase the ability to compete in the sector.",2015
Restructuration of logistic networks: An industrial case study in Colombia,"IAMOT 2015 - 24th International Association for Management of Technology Conference: Technology, Innovation and Management for Sustainable Growth, Proceedings","In the current competitive environment, logistics has been considered one of the key elements that allows growth strategies for countries and companies. Emerging economies such as Colombia have implemented different plans to achieve sustainable development and technology advantages for the national firm's supply chain, but sometimes the region characteristics difficult the creation of networks. This inconvenient leads to the question: how can viable tactics lead companies to affront management logistic challenges in developing countries? The present paper introduces a proposal that contributes in the search of a possible solution in the Fast-Moving Consumer Goods (FMCG) industry case in Colombia and similar regions. In first place, this paper presents the general variables that are affecting the management of logistic networks in Colombia based on specialized literature. After this, a Colombian FMCG corporation is studied in order to develop a simulation model and identify possible opportunities and solutions. Finally, relations between the results of the case study and the impact that would be generated through a general proposal for the country and comparable areas is established. As a result of this work, the status of Colombian logistics is evidenced, as well as the future perspectives and opportunities of strengthening in the management of networks in the country. Additionally, this investigation seeks to promote the discussion around possible applications and systems to increase the present performance in the FMCG business. People, organizations and productive sectors constantly need to update their methods and technology according to their objectives. The study aims to provide a divulgation space of experiences and impacts, and give logistics practitioners the opportunity to adapt the knowledge and strengthen the development of sustainable innovation for competitiveness. It is expected that over the years, the implementation of new procedures can be expanded to remote regions. Copyright © 2015 by the National University of Colombia.",2015
Technology as an innovation factor in Colombian enterprises [Tecnología como factor de innovación en empresas colombianas],Revista Venezolana de Gerencia,"The development of innovations depends on multiple factor in order to achieve consolidation of successful projects which come from the definition of an adequate strategy. One of the factors is technology given that it contributes to the achievement of the proposed business results, therefore, the aim of the present study consist of verifying if the acquisition of information technology generates innovation benefits for the Colombian enterprises; furthermore, analyzes its importance as an input to the definition of organizational strategy. In order to do so, a statistic correlation exercise between the variables of technology an innovation acquisition and elements of the II Development and Technological Innovation Survey in Colombia was made, indicating if dependence between the variables results exists. As a main conclusion, the technology acquisition in Colombia is not an active part of the organizational strategy or its use has been oriented to activities which do not generate competitive advantage. This study is intended to contribute to the management process development in the companies of the country. © 2015, Universidad del Zulia. All rights reserved.",2015
Why are diagnosis-related groups unpopular in Colombia? [Porque grupos de diagnósticos homogêneos não são implementados na Colômbia?] [¿Por qué los grupos relacionados de diagnóstico no se implementan en Colombia?],Cadernos de Saude Publica,"The aim of this study was to explore the determinants of non-implementation of diagnosis-related groups (DRGs) by hospitals in Colombia. A qualitative case was carried out to analyze the directors’ perceptions in six hospitals with and without DRGs in Bogotá. The interviews are based on the Innovation Diffusion Theory. The directors had similar perceptions of the determinates. DRGs were seen as positive, but encountered organizational and institutional obstacles. Without a targeted public policy, the likelihood of implementing DRGs in Colombia is slight. © 2015, Fundacao Oswaldo Cruz. All rights reserved.",2015
The modified Delphi method. An approach from the Soft Systems Methodology [El método delphi modificado. Un acercamiento desde la metodología de sistemas suaves],Espacios,"The article presents a revision of a state of the art related to the Delphi method, its definitions, characteristics and applications. Based on this revision, its problems were identified, and one of them related to the non-structure structuring of problems of human activity was analyzed. With the end of complementing the analysis, a case of the application of soft system methodology was made, conceived in the 1960's by Peter Checkland in a Doctoral dissertation related to the Delphi method and its alignment with an innovation strategy in the frame of a management innovation model; with the purpose of generating a solved problem. Amongst the main conclusions, the advantages of the use of a soft system methodology were highlighted to help the improvement of non-structured human activity with the Delphi method, and its alignment with the company's innovation strategy in the frame of innovation management models. Also, the possibility of complementing the soft system methodology with priority surveys to obtain expert opinion related with the components of a Doctoral dissertation.",2015
Born globals from the resource-based theory: A case study in Colombia,Journal of Technology Management and Innovation,"This paper describes how a born global firm goes into international market from inception at its early years. The objective of this paper is to analyze from the resource-based theory how a born global firm engages in international market. This empirical investigation has been carried out as an explorative single-case study, a high-tech firm, Digital Partner, based in Medellin, Antioquia. The main findings of the research show that organizational capabilities based on intellectual capital are crucial for the development of a born global. Thus, capabilities such as entrepreneurship, global vision, internationally market knowledge, learning management, IT capabilities, technological innovation, collaborative work, networks and customer orientation are recurrent and they correspond to other similar research results. Contributions of the study are both academic (for the advance of the research in born global field) and practical (for the design of governmental policies to foster born global firms). © Universidad Alberto Hurtado, Facultad de Economía y Negocios.",2015
National Laboratory of Smart Grids (LAB+i) at the National University of Colombia-Bogotá Campus,"2014 IEEE PES Transmission and Distribution Conference and Exposition, PES T and D-LA 2014 - Conference Proceedings","This paper describes the design and implementation of the National Laboratory of Smart Grids in the University Campus (LAB+i) with the real-time integration of electricity, water and/or gas systems through six layers of Smart Grids that allow to make measurement of a process, local or remote communication in order to be integrated to the supervision and management system. Likewise in the following layers of the LAB+i, information management processes, decision making, modeling of systems and processes that enable the development of optimum efficiency and productivity applications are made. LAB+i is designed as a testing platform of technologies associated with Smart Grids, developing prototypes of measurement systems and communication drivers related to Smart Grids for Smart Cities. Finally, the research capacities, technology and innovation development are presented, which the LAB+i laboratory would allow to include the incorporation of local business pilot projects to be optimized, adaptive technology testing, evaluation of local environmental conditions and their requirements. © 2014 IEEE.",2014
"Technological change and innovation in Latin American emerging economies: The pork industry of Antioquia, Colombia",Handbook of Research on Economic Growth and Technological Change in Latin America,"Innovation and technology, in appropriate business environments, are considered improvement and survival tools directly related to the establishment of competitive advantages. However, this must be accompanied by a growing economy, and, in some cases, governmental policies that encourage the industry. This chapter inquires about several factors involved in the innovation and technological change of the pork industry in Antioquia, Colombia, based on original research results and other contributions of the authors. The managerial assumption is simple: free trade and strategic moves of the biggest competitors indicate that Small- and Medium-Sized Enterprises (SMEs) in the pork industry must accelerate their technological change via innovation management by addressing different factors that are hindering the establishment of competitive advantages. The authors offer a possible path of action from a management perspective to support that the industry will form an oligopoly should innovation management not occur. © 2014 by IGI Global. All rights reserved.",2014
The maturity of capacities for innovation in Colombian enterprises [Madurez de las capacidades de innovación en empresas colombianas],Revista Venezolana de Gerencia,"Some of the great enterprises of Colombia, leaders in research, development and innovation, are located in the city of Medellin. However, to date, few studies have been made regarding the capacities for innovation underlying their good results in developing new and improved products. The objective of this article is to determine the maturity ofthe innovation capacities for five ofthese companies. The theoretical model of Essmann and Du Preez (2009) was used, which consists ofthree dimensions: a construct for innovation capacity, a maturity scale and an organizational construct. In terms of methodology, an index of innovative capacity was constructed and the ranges for three maturity levels were calculated, using the analysis cluster (Jung et al, 2009); this permitted classifying the companies under study. Results show that all the companies have a maturity level titled formalized and predictable. In conclusion, although the best practices associated with each innovation capacity have been identified and implemented, individuals have not appropriated them and do not use them in a systematic manner. © 2014, Universidad del Zulia. All rights reserved.",2014
