Título Artículo,Nombre Revista Científica,Resumen,Año
Information technology models for the adaptation of the production processes,Journal of Physics: Conference Series,"For an organization it is important to have clearly the objectives, goals and purposes of its business and that all people who are related to it have the same clarity of how the organization works and where it wants to go, for this there are management tools such as the balanced scorecard that along with the control panels can get to have an articulation and better knowledge of the processes that exist within it. A review of the state of the art of the management tool is made to know its components and be able to design a model that fits the experimental farm of the Universidad Francisco de Paula Santander, Ocaña, Colombia, attached to the ""Facultad de Ciencias Agrarias y del Ambiente"", to support the administrative process of the same. The balanced scorecard will be taken into account, which is a management tool based on indicators that facilitate the monitoring and achievement of farm objectives, helping the organization to meet its objectives, bearing in mind that the balanced scorecard has 4 important approaches to the process: client, internal processes, innovation and training. For the development of the investigation a methodology with a quantitative approach will be handled where it is tried to know the handling of the processes and to adapt them to the models of government of technologies of the information, with the objective to diagnose and to determine the key indicators of the productive processes of the farm of the university contributing to the continuous improvement. © Published under licence by IOP Publishing Ltd.",2019
Innovation in Latin America through the lens of bibliometrics: crammed and fading away,Scientometrics,"Research in the field of innovation in business, management, and accounting (BMA) in Latin America (LATAM) has surpassed all expectations of its net output. Yet this digital tide suggests several concerns regarding its impact and both its established and emergent research topics at the individual, institutional, and country level. In this paper, an outlook of the field was developed based on a sample of + 1300 documents indexed in Scopus from 1983 to 2018. Public institutions in Brazil and Colombia have been both the most cited and productive in the region. Nevertheless, documents lead by non-LATAM authors showed significant differences in both paper citations and journals’ h-index compared to leading authors from LATAM. Three of the major concerns raised were, first, a growing inter-regional gap among LATAM countries. Second, the intensive use of a journal with predatory features over the last 5 years, therefore cites/document measure is at the lowest point of the past 17 years. And third, the delay of recently emergent topics in the region that have been in the literature for more than a decade, while frontier topics for BMA innovation such as those of Industry 4.0 remain unnoticed. © 2019, The Author(s).",2019
Conceptual model of information technology management for smart cities: Smarticity,Journal of Global Information Management,"This article presents a proposal of conceptual model for public administrations that allows analyzing the level of IT management capacity as an enabler of smart cities from a multidimensional and dynamic approach taking into account technological, institutional and innovation aspects. The model includes five domains (e-government strategy, Public Innovation, Data Management, IT Services and Infrastructure) that are described in terms of key domain areas, objectives and questions. The model was conceptually validated with four IT offices in Colombia and a pilot test was developed in the Atlantic department. A profile of information technology management capabilities was obtained from public data of the Ministry of ICT in Colombia. Copyright © 2019, IGI Global.",2019
Relationship between innovation and performance: Impact of competitive intensity and the organizational slack [Relação entre inovação e desempenho: Impacto da intensidade competitiva e do slack organizacional] [Relación entre la innovación y el desempeño: Impacto de la intensidad competitiva y el slack organizacional],RAE Revista de Administracao de Empresas,"Innovation is a key factor in organizational performance. Although the strategic theory has delivered the references to understand the relationships between these two variables, there are still many gaps that need to be filled, and more empirical validation is necessary. This study aimed to verify how the relationship between innovation and performance is affected by the presence of precursor variables such as competitive intensity and organizational slack. The study was carried out through an explanatory and cross-sectional investigation, by applying structural equation modeling (SEM) to a sample of SMEs in Bogotá (Colombia). The results make a relevant contribution to the literature on strategic management by showing that competitive intensity and organizational slack induce innovation and positively impact performance. © RAE.",2019
Effectiveness of a case management model for the comprehensive provision of health services to multi-pathological people [向多种疾病患者全面提供医疗服务的案例管理模式的有效性],Journal of Advanced Nursing,"Aim: To determine the effectiveness of a case management model for approaching multi-pathological people in a health promoting entity of the contributory healthcare scheme in Bogotá, Colombia between 2018 -. Design: Mixed methods research. Method: The study contemplates two components: a quantitative component using a quasi-experimental analytical design before and after longitudinal intervention to determine the effectiveness of the case management model and a qualitative descriptive design to understand the experience of the participants about the model. The Administrative Department of Science, Technology and Innovation of Colombia (Colciencias) funded this project by means of call 777—November 2017, under the financing agreement No. 848—December 2017. Discussion: Addressing problems deriving from the structure of the Colombian healthcare system is crucial for implementing case management models. Furthermore, the effectiveness of such models may be affected by power relations and market failures, but the proved potential of a model may represent a generalized benefit for the Colombian health system. Impact: In Colombia, considering complications and management of chronic non-communicable diseases as isolated cases is considered as the highest cost events in healthcare provision, since an average of 12.8 million pesos is invested in each patient. This has led to rethink the management in these patients by means of a comprehensive model that guarantees the effectiveness of healthcare delivery, in the framework of a healthcare system heavily affected by payment capacity, where the market has a strong predominance, such as the case of Colombia. Trial registration number: RPCEC00000293. © 2018 John Wiley & Sons Ltd",2019
Cycles of action and reflection as the basis of transformative innovation,Management Research Review,"Purpose: This paper aims at explaining the design process of a learning model targeting potential entrepreneurs with no technical or business expertise aiming to develop sustainable business models in deprived areas. The case that the paper explores focuses on experiential learning and learning in adulthood to design a learning model that considers context and socio-demographic characteristics, makes clear the interconnections between sustainability principles, entrepreneurship rationale and design methodologies and includes actions and processes of reflection and contextual interaction. Design/methodology/approach: Following a recursive argument, the paper applies design research methodology (DRM) to systematically design the “transformative innovation model” that Product Co Creation Centers (PC3) from the University of Twente (The Netherlands) has developed. Findings: Building on Kolb’s cycle of experiential learning, the result of applying DRM is a learning cycle of confrontation, observation, practice and application. The proposed learning model is applied to a specific setting in Colombia, allowing to verify and validate whether the learning model leads to the expected outcomes. It is argued that an interdisciplinary approach, a focus on feedback loops and the consideration of the context are important elements for addressing and transforming complex problems related to sustainable development from the bottom-up. Originality/value: This paper contributes to academic research in management emphasizing a solution-finding approach based on a prescription-driven research process, informed by design science research. © 2018, Emerald Publishing Limited.",2019
"Business innovation: Competitiveness factor and quality of life in popayán, colombia [Innovación empresarial: Factor de competitividad y calidad de vida en popayán, colombia]",Revista Venezolana de Gerencia,"Under today’s competitive conditions, micro, small and medium-sized enterprises in Popayán (Colombia) must maintain their economic development in competitive markets. The objective is to determine the role of innovation in Popayán enterprises, as a competitiveness factor to achieve improvement of the quality of life in the region. The research is qualitative, exploratory and uses as an instrument the semistructure interview in thirty companies. The main results indicate that innovation is based on guidelines or technologies for continuous improvement in processes, products and services that are applied as a competitive advantage; framed in external factors to be aware of changes in the environment and take advantage of technological improvements, and internal factors in implementation of open, participatory management, decentralization in decision-making, motivation of staff and commitment to innovation. As important conclusions, it is obtained that, innovation is a competitive advantage that allows the differentiation, and adapt to changes of the environment. It can be seen that companies offer improved products and services, and to innovate, they do not invest large amounts of resources, however, they have managed to achieve innovation and, therefore, improvement in quality of life. © Universidad del Zulia. All rights reserved.",2019
Effect of absorptive capabilities on acquisition and exploitation open innovation capabilities,"Managing Technology for Inclusive and Sustainable Growth - 28th International Conference for the International Association of Management of Technology, IAMOT 2019","Colombia is a country that has achieved important growth in innovation in its services and industrial sector. However, both research and empirical evidence about its development is very limited. Innovation based on firms’ capacity of transformation and exploitation is one of the main keys to acquisition and exploitation of open innovation. This empirical study analyses the relationship between absorptive capabilities and acquisition and exploitation open innovation capabilities in a sample of 123 organizations situated in the city of Medellin, Colombia. The findings show that firms developing absorptive capabilities may have better probabilities to improve their open innovation acquisition and exploitation. This study suggests that companies where managers motivate their employees to use external information and external knowledge in the innovation process may have a better chance of improving their innovation performance. © IAMOT 2019.",2019
Conceptualization of technology transfer and its impact evaluation: Case Cotecmar,"Managing Technology for Inclusive and Sustainable Growth - 28th International Conference for the International Association of Management of Technology, IAMOT 2019","In this changing world and globalized economy, technology transfer processes play a fundamental role in the learning and development of a company’s capabilities, leading the organization’s growth strategies towards a technological flow consisting of the dissemination, transmission and appropriation of knowledge, experiences, know-how and technologies from one organization to another in order to obtain for both a benefit that contributes to being competitive and remaining in the market. From a business perspective, technology and knowledge are fundamental assets for the growth and sustainability of the organization, being these the pillars on which competitiveness and its differentiation in the market are based. Today, technological development and the creation of new and improved products and services have become drivers for the global economy, whereas emerging as challenges for organizations that must keep pace with the advance of science, technology and innovation if they want to remain in the market being competitive and generating returns (Rios and Marroquín, 2012). Technology transfer strategies then become drivers and generators of knowledge that impact the development of technological capabilities in the company and directly or indirectly promote the growth of a sector of the economy. These types of projects bring with them an effort on the part of the organizations that use personnel, resources and time in a transfer process in search of the increase of their technological capacities and business development. In Colombia, for example, technology-based organizations are companies that usually make use of this type of transfer processes such as licensing agreements, technical assistance and services contracts, mobility of personnel towards other industries, company mergers or acquisitions or intellectual property rights, with the objective of impacting their business growth through the development of new and better products and services for the benefit of their clients, in addition to impacting the country’s industrial development. An example of this is the Corporación de Ciencia y Tecnología para el Desarrollo de la Industria Naval, Marítima y Fluvial—COTECMAR (Science and Technology Corporation for the Development of the Naval, Maritime and Fluvial Industry), which by developing technology transfer projects has achieved the country’s technological independence in terms of the manufacture of ships and naval devices, appropriating technologies and knowledge from shipyards with the most experience in the world. Given this situation, this article presents a conceptualization and establishes the main characteristics of technology transfer processes, tracks the main contributions of authors and institutions towards the evaluation of the effects of such projects on the growth of the company and finally proposes a process for the evaluation of their impact through a practical case. The evaluation methodology is based on the disaggregation of dimensions used by the Logical Framework Methodology guided by the four approaches put forward by Daniel Stufflebeam to carry out an evaluation process. © IAMOT 2019.",2019
"A tool for the interpretation of organizational myths: The case of innovation in the City of MedellÃ­n, Colombia",Organizational Cultures,"Considering that myths in organizations tell stories that allow recognizing a set of values, beliefs and ideologies that imprint individuality to the organization, the purpose of this study is to propose a conceptual tool for Organizational management by analyzing and interpreting myths in organizations. Said tool can be easily implemented, as it is shown in its practical application to the analysis of innovation in the city of MedellÃ­n, Colombia. In the past, MedellÃ­n was associated with drug trafficking and destruction and today is considered the most innovative city in the world. By applying the proposed tool to the innovation case of MedellÃ­n, it is possible to analyze and understand how this transformation was possible in the city of MedellÃ­n and how the myth of management is an intermediary between the myth of referenceâ€”paradigm of the pastâ€”and the organizational mythâ€”associated with organizational goals. Â© Common Ground Research Networks, Manuela Escobar-Sierra, Felipe Calderon-Valencia.",2019
Campesinos del Sonson-Colombia facing the program to strengthen productive capacity [Campesinos del Sonsón-Colombia frente al programa de fortalecimiento de la capacidad productiva],Revista de Ciencias Sociales,"From a hermeneutic perspective, the Urban Agriculture Program of the Caritas La Dorada Social Pastoral is analyzed. Program that seeks to improve the living conditions of victims of violence. It begins with the demobilization of paramilitary groups and the return of families to their plots; It is intended that they produce fresh foods, improve their diet and market surpluses. This study investigates the perceptions of the beneficiaries through in-depth interviews and participant observation. The fieldwork was carried out for 2 months, using the non-probabilistic sampling technique, with 40 older adults from the San Miguel district in the municipality of Sonson. Of the interviews conducted, training was received for 40% of the beneficiaries, and training in broiler management allowed them to improve their diet; In addition, the beneficiaries believe that the productive techniques taught demand a long time and there is no reduction in production costs or increase in short-term income. With this study, the perception and adaptation strategies that families use in the face of change or innovation processes are recognized. © 2019 Korean Society of Exercise Rehabilitation.",2019
Energy management in the health sector of Colombia: A case of clean and sustainable development [Gestión Energética en el Sector Salud en Colombia: Un Caso de Desarrollo Limpio y Sostenible],Informacion Tecnologica,"The objective of this article is to analyze energy management from the perspective of clean and sustainable development in institutions that provide health services in Colombia. The study is carried out through a qualitative approach with a method of documentary review of the literature with information from scientific articles of the last 8 years, located in specialized databases, this with the purpose of exploring advances in this area worldwide and determine the contributions that could be replicated in the country. Results show that there is evidence of institutional support for the development of energy management, as well as the definition of various alternatives and areas of intervention depending on the different services provided. It is concluded that the sources of greatest energy consumption are concentrated in air conditioning and lighting, and that strategies to reduce costs are related to the optimization of energy supply contracts and hospital facilities. © 2019 Centro de Informacion Tecnologica. All rights reserved.",2019
Relationship between knowledge management and innovation capacity in health institutions [Relación entre la gestión del conocimiento y la capacidad de innovacion en instituciones de salud (Colombia)],Espacios,"This article analyzes the relationship between knowledge management and innovation capability in health institutions. The review of the literature allowed to identify and to establish the conceptual definition and contextualization of the determining variables that affect in the proposed relationship. The empirical study was carried out in high complexity hospitals in Colombia. The data was processed using the structural equation modeling (SEM) technique. The results show that the variables of the knowledge management (competitive environment, the flexible structure, the organizational culture, the learning climate, the exploration capacity and the exploitation capacity), are determinants and positively effects on the innovation capability in health institutions. © 2019 Revista ESPACIOS.",2019
"Analysis of the management of science, technology and innovation projects under the PMI principles [Análisis de la Gestión de proyectos de Ciencia, Tecnología e Innovación bajo los Principios del PMI]","Proceedings of the LACCEI international Multi-conference for Engineering, Education and Technology","The Research, Development and Innovation projects have important challenges from the point of view of their management. In this article, an analysis of the management of this type of projects based on the principles of project management published by the Project Management Institute is carried out. The analysis is applied to the case of projects financed by the General System of Science, Innovation and Technology Royalties in the department of Atlántico in Colombia. With the results presented, We intend that the science and technology institutions and the research directors of the projects can have better management tools in the execution of this type of projects. © 2019 Latin American and Caribbean Consortium of Engineering Institutions. All rights reserved.",2019
Agro-biotechnology management based on the analysis of the influential factors in the organization of the countryside in Colombia and Venezuela [Gerencia agro-biotecnológica basada en el análisis de los factores influyentes en la organización del campo en Colombia y Venezuela],Espacios,"The research conceptualizes Agro-Biotechnological Management (GABT), for Colombia and Venezuela from the perspective of the analysis of the influencing factors in the organization of their fields, according to the postulates of the DOGIL model from Petit (2012), associated with innovation in management. The results of the study constitute a theoreticalmethodological contribution for the strategic transformation of the management in question; at the same time, a useful data system is exhibited as a scientific basis for the emergence of a theoretical management model. © 2019 Revista Espacios.",2019
"Knowledge management in developing regions: The case of Valle de Aburrá, Colombia",International Journal of Knowledge-Based Development,"This study aims to identify the components of a knowledge management (KM) model to support innovation governance in a Colombian cosmetics cluster. The inter-organisational management of knowledge applied to innovation governance, and the perspective of endogenous economic development emphasises the structural specificities of developing countries. In line with this objective, the community-based participatory research (CBPR) and Delphi methods were combined to collect information from the cluster's different stakeholders, among them dependent shareholders who expressed their views through spokespersons. In an initial stage, a knowledge management model was built. After a second stage with a planning exercise, it integrates organisational and contextualisation proposals, together with the specificities of each of the cluster's stakeholders. Copyright © 2019 Inderscience Enterprises Ltd.",2019
Analysis of the management model for the development of technological innovation in the public universities of the Caribbean coast region of Colombia [Análisis del modelo de gestión para el desarrollo de innovación tecnológica en las universidades públicas de la Costa Caribe colombiana],Espacios,"An analysis of the management model for the development of technological innovation in the faculties of engineering of the public universities of the Caribbean Coast is presented. A descriptive investigation was carried out, with field design and population of 4 universities. The results show that the variable management model has a high presence in the institutions, while the variable of technological innovation has a moderate presence, indicating that it is necessary to strengthen the R & D processes in the university context. © 2019.Se presenta un análisis del modelo de gestión para el desarrollo de innovación tecnológica en las facultades de ingeniería de las universidades públicas de la Costa Caribe. Se realizó una investigación descriptiva, con diseño de campo y población de 4 universidades. Los resultados muestran que la variable modelo de gestión tiene alta presencia en las instituciones, mientras que la variable de innovación tecnológica tiene una moderada presencia, indicando que se necesitan fortalecer los procesos de I + D en el ámbito universitario. © 2019.",2019
Integrated Management Systems and Modern Management,"2018 Congreso Internacional de Innovacion y Tendencias en Ingenieria, CONIITI 2018 - Proceedings","In Colombia 17% of the Universities have high quality accreditation, these being the Higher Education Institutions HEI, more competitive and of quality in the market, all of them favored by an Integral Management System -IMS, which allow to establish their policies and achieve their objectives. Then the question arises: How could the administration of HEI be improved? Thus, the objective of this Investigation is to analyze the importance of IMS in modern management, as well as how IMS affect the strategic institutional direction. The results present a methodology to implement the IMS and make it integrate with the Higher Education Quality Assurance System -SACES. The following studies relate to the way of continuing integrating other systems of management, one presents of conclusive form the integration to the SIG of the management of the Investigation, development and innovation I+D+I through the NTC 5801 standard, case Universidad Militar Nueva Granada -UMNG. © 2018 IEEE.",2018
