Título Artículo,Nombre Revista Científica,Resumen,Año
Co-creation model in small and medium businesses: Case study of the Colombian dairy sector,Lecture Notes in Computer Science (including subseries Lecture Notes in Artificial Intelligence and Lecture Notes in Bioinformatics),"Micro and small enterprises in Colombia (MSEs) need to strengthen their competitive, sustainable and sustainable advantages to respond adapt and sustain in the market. They should focus their efforts on knowledge management, Information and Communication Technologies (ICT), innovation, continuous improvement, and Co-Creation. This paper presents a co-creation model based on knowledge management that allows us to innovate in the dairy sector, as a form of adaptation and survival, differentiation and competitiveness as a tool for decision-making. © Springer International Publishing AG, part of Springer Nature 2018.",2018
Econometric analysis of the industrial growth determinants in Colombia,Lecture Notes in Computer Science (including subseries Lecture Notes in Artificial Intelligence and Lecture Notes in Bioinformatics),"An econometric study is carried out using a panel data model with fixed effects to identify the industrial development determinants in Colombia during the term 2005–2015. The database used in the study corresponds to World Bank and the Colombian state. The determinants of industrial growth identified at the theoretical level that allow the enhancement of productive capacities to face foreign competition in Colombia are: innovation; networks of innovations and knowledge among companies and organizations; the interest rate; the capital-product ratio, the unit labor cost; and the exchange rate. The amount invested in scientific, technological and innovation activities by industrial group is the only variable that is not significant in the model. © Springer International Publishing AG, part of Springer Nature 2018.",2018
Contributions to medicine and education of the hospital San Juan de Dios [Aportes del hospital San Juan de Dios a la medicina y a la educación],Revista Facultad de Medicina,"Introduction: Studying the academic and scientific contributions from the San Juan de Dios Hospital Complex (CHSJD by its acronym in Spanish) —which include the San Juan de Dios Hospital, Instituto Materno Infantil and Instituto de Inmunología— during the twentieth century is an important conceptual basis for promoting the development of university hospitals in the country and the continent. Objective: To expose the contributions from the CHSJD to different fields of medicine, the development of medical education and the construction of the school of Medicine. Materials and methods: A qualitative descriptive analysis was carried out, focusing on the main milestones reached by the CHSJD in the period between 1866 and the suspension of its activities. Key informants were interviewed, and an online survey and a documentary review were performed. Results: Thanks to its association with the faculties of the Universidad Nacional de Colombia, the San Juan de Dios Hospital was a pioneering university hospital in Colombia. Its multiple contributions in different disciplines are still in force and, despite its closing, it is still recognized as one of the largest sources of scientific knowledge in the country. Conclusion: It is essential for the development of university hospitals that the scientific-teaching staff takes on the challenge of implementing and developing innovations aimed at solving health challenges. © 2018, Universidad Nacional de Colombia. All rights reserved.",2018
"The entrepreneur in Colombia, an answer to the challenges of competitiveness and sustainable development [El emprendimiento en Colombia, una respuesta a los retos de competitividad y desarrollo sostenible]",Espacios,"At present, the economy is subject to a great number of changes and contractions, which force the search for alternatives that allow the sustainability, growth and implementation of mechanisms, that generate in the future lasting solutions that take root in the development of any country. In Colombia, the economic system has been hit by a multidiversity of factors, including the internal armed conflict, which is approaching a concerted goal, thanks to the current government's management. All this combined with the demands of globalization, which has dominated the region's scenarios, have greatly boosted the positioning of entrepreneurship as an alternative to productivity, marketing and innovation. Then, and in order to establish the factors that are promoting and stimulating entrepreneurship in Cartagena, a documentary review of the context of the project will be carried out and different studies and research that may contribute to the design of future programs or intervention plans, in pursuit of the promotion of the quality of life of the communities of this important Colombian city. © 2018.",2018
"Human talent management's relation including pymes innovation generation in Barranquilla, Colombia food processing industry [La gestión del talento humano y su relación con la innovación en las pymes de la industria de alimentos en Barranquilla-Colombia]",Espacios,"This research determines human management factors that contribute to the generation of innovation in SMEs of the food industry in Barranquilla, to enact their relationship; the theoretical basis allowed to establish the conceptual dimension from the administrative management and the policy of STI as reference. The methodological approach is mixed, combining descriptive method and case study, that allowed to know the context of the organizational management, the capacity of innovation and its relevance in the sector. © 2018.",2018
A causal mechanism of policy innovation: The reform of colombia’s oil-rents management system [Um mecanismo causal de inovação de política pública: A reforma do sistema de gestão de rendas petroleiras na Colômbia] [Un mecanismo causal de innovación de política pública: La reforma del sistema de gestión de rentas petroleras en Colombia],Revista de Estudios Sociales,"This article analyzes policy innovation in Colombia, through the adoption of a new centralized oil-rent management system in 2011, after 20 years of decentralized policies. Using a policy-design framework, we identify a causal mechanism linking the opening of a policy window to policy change as a combination of the emergence of a new policy network, the adoption of a new policy paradigm and the selection of a new instruments mix. Drawing on Bayesian statistics, the 11 tests conducted on the causal mechanism show the importance of State resources of information, authority, treasury and organization to assess the outcome of policy change. © 2018, Universidad de los Andes, Bogota Colombia. All rights reserved.",2018
Novel technological and management options for accelerating transformational changes in rice and livestock systems,Sustainability (Switzerland),"Agricultural producers grapple with low farm yields and declining ecosystem services within their landscapes. In several instances, agricultural production systems may be considered largely unsustainable in socioeconomic and ecological (resource conservation and use and impact on nature) terms. Novel technological and management options that can serve as vehicles to promote the provision of multiple benefits, including the improvement of smallholder livelihoods, are needed. We call for a paradigm shift to allow designing and implementing agricultural systems that are not only efficient (serving as a means to promote development based on the concept of creating more goods and services while using fewer resources and creating less waste) but can also be considered synergistic (symbiotic relationship between socio-ecological systems) by simultaneously contributing to major objectives of economic, ecological, and social (equity) improvement of agro-ecosystems. These transformations require strategic approaches that are supported by participatory system-level research, experimentation, and innovation. Using data from several studies, we here provide evidence for technological and management options that could be optimized, promoted, and adopted to enable agricultural systems to be efficient, effective, and, indeed, sustainable. Specifically, we present results from a study conducted in Colombia, which demonstrated that, in rice systems, improved water management practices such as AlternateWetting and Drying (AWD) reduce methane emissions (~70%). We also show how women can play a key role in AWD adoption. For livestock systems, we present in vitro evidence showing that the use of alternative feed options such as cassava leaves contributes to livestock feed supplementation and could represent a cost-effective approach for reducing enteric methane emissions (22% to 55%). We argue that to design and benefit from sustainable agricultural systems, there is a need for better targeting of interventions that are co-designed, co-evaluated, and co-promoted, with farmers as allies of transformational change (as done in the climate-smart villages), not as recipients of external knowledge. Moreover, for inclusive sustainability that harnesses existing knowledge and influences decision-making processes across scales, there is a need for constant, efficient, effective, and real trans-disciplinary communication and collaboration. © 2017 by the authors.",2017
"Evaluation of the professional profile in information systems, library science and archival science at the university of la salle, colombia, from the perspective of graduates [Evaluación del perfil profesional en sistemas de información, bibliotecología y archivística de la Universidad de la salle, Colombia, desde la perspectiva de los egresados]",Revista Cubana de Informacion en Ciencias de la Salud,"The objective of the present study is to evaluate the professional profile in Information Systems, Library Science and Archival Science declared in the curricular design of the corresponding program at the University of La Salle in Bogotá, Colombia. The study is based on theoretical criteria according to which evaluation of professional profiles is a strategic component in the identification of curricular relevance, on the basis of which adjustments and changes must be proposed aimed at aligning the training offers to the needs imposed by trends in the fields of knowledge and the demands of the labor markets where graduates have accumulated valuable information serving as feedback for those profiles. The qualitative approach and the focal group technique were the essential elements in the methodology. Ten graduates from the Program participated, all of whom held managerial and coordination posts when the study was performed. According to the main results obtained, the following aspects are all highly relevant to the training: project management, budget management, innovation, quality management, knowledge management, planning of projects related to technologies applied to document management, digital management of contents, and preventive conservation of the document heritage in physical and digital formats. It is concluded that professional profile evaluation should be a permanent task which takes account of the constant changes that occur, so as to synchronize the curricular offers of training institutions to the demands of socio-productive sectors and the advancement of science and technology. © 2017, Centro Nacional de Informacion de Ciencias Medicas. All rights reserved.",2017
Measuring organizational capabilities for technological innovation through a fuzzy inference system,Technology in Society,"As a result of the strategic and operational management of research in higher education institutions (HEIs), the organizational Technological Innovation Capabilities (TICs) contribute to reaching strategic objectives of transfer of results in research and development (R & D) to society and industry, for this reason, it is necessary to take measurements to identify the index creation and consolidation of organizational capabilities. Despite the importance, theoretically given to the TICs, a great gap is found in the scientific literature regarding the measurements of these capabilities in the higher education sector. In this paper, the results of the implementation of a fuzzy inference diagnostic system for organizational capabilities for innovation in a university institution (UI) in the city of Medellin, Colombia are presented. The system consists of the application of a structured diagnostic instrument - type interviewed-to the management and teaching staff of the institution. The data is adapted to the requirements of a fuzzy inference system, in which previously defined variables are related, their values are standardized and entered in an inference system. The values were implemented and processed in the Fuzzy Logic Toolbox - MATLAB. As inference system output, concrete numerical values, and surfaces of fuzzy inference were obtained to formulate organizational strategies aimed at improving the technological innovation capabilities of the institution. © 2017",2017
"From degradation of water and institutional innovations to the greening civil society: An analysis of the problems of water quality in the high Cauca River Basin, Colombia [De la degradacion hidrica y las innovaciones institucionales, a la sociedad civil ambientalizada: Un analisis de la problemÁtica de la calidad del agua en la cuenca alta del rió cauca, Colombia]",Revista Luna Azul,"At the end of the first decade of the 21st century, the issues surrounding the quality of water resources are increasingly evident at the global and regional levels. However, under the influence of the environmental reform of the 1990s in Colombia, the institutional framework sought to avoid the threat by leaning towards the decentralized management of sustainability and the application of economic instruments such as the compensatory rate (Pigouvian tax). The purpose of this article is to review the performance of these two standards against the role of civil society in the intervention on water quality in the high basin of the Cauca river. For this, the institutional analysis combined with econometric tools including models with panel, ANOVA and finally main components are used. In the end, the scope of civic citizenship as a complement or alternative to the typical tools of the regionalized public administration is discussed. The results show, among many others, the harmlessness of financial instruments such as compensatory rates to attack water contamination, along with the capacity of social organizations to control associative processes in defense of the river water quality. © 2017 Universidad de Caldas.",2017
Resource efficient & cleaner production (RECP) for the competitiveness of the hospitality sector [Eficiencia en el uso de los recursos y pr oducción más limpia (RECP) para la competitividad del sector hotelero],Revista de Gestao Social e Ambiental,"In the Latin-American context, there is a challenge related to hotel sector, which needs to be competitive and sustainable. The Resource Efficient and Cleaner Production (RECP) as a strategy that involves productive efficiency, environmental protection, and human development, allows creating value and improving the competitive performance. From a perspective of competitive strategy and creating shared value, this study characterizes the relevance of cleaner production and describes its potential contribution to the competitiveness of the hotel sector in Atlántico, Colombia. We developed a descriptive research with a quantitative approach and a descriptive analysis in 36 hotels, through a survey with closed questions with nominal and Likert scale. The RECP allowed obtaining an economic, environmental and social effectiveness in a medium level, to maximize the profits and to fulfill the statutes. We concluded RECP gives the opportunity to rethink the competitive strategies to the creation of shared value through linking environmental and social variables with the organizational management as a source of innovation, productivity, and competitive advantage.",2017
Innovation and creativity in process control and manufacturing,International Journal on Interactive Design and Manufacturing,"The industry and manufacturing processes are characterized by a variety of algorithmic methodologies and techniques that describe their function. Therefore; the methodology for teaching automatic processes control for innovating projects, build a profile of the student based on validated evidence of the professional comprehensive training solution, defined in learning skills (Tobón, in Formación basada en competencias, Pensamiento complejo, diseño curricular y didáctica. Bogota, Colombia, 2005) for the structured approach to the problem of controlling processes and workable solution, aimed to apply integration of management actions functional process controls, integrating threads and systemic responses of these. © 2014, Springer-Verlag France.",2017
"Intelligent higher education model based on competences and architectures for the Colombian post-conflict ,m","Proceedings of the LACCEI international Multi-conference for Engineering, Education and Technology","In our Colombian institutions, we find educational and entrepreneurial leaders who are technophiles towards systems based on knowledge and others, and on the other way, we find leaders with the technophobia towards those systems, situation that could act like a sword of double edge: expensive errors, vs. the unwanted Accountability. This seems common in third world countries. Intelligent Knowledge based systems (IKBS) have to do with the creation of value from intangible intelligent assets, that are resurrected from amalgams of Artificial Intelligence, Knowledge Engineering (KE), BUSINESS PROCESS REENGINEERING (BPR), Cognitive Systems Engineering, Software Engineering, and Third Millennium organizations, among others. Intelligent behavior requires being able to acquire and manage information, data and knowledge to make effective decisions for organizations to function intelligently in crises. Requires intellectually demanding environments with more open minds. The U. San Jose-FESSANJOSE has developed a supportive environment for decision-making in the complexity of higher education (HE), and a set of planning tools has been designed to deal with the crisis. These tools, are expected to help stakeholders develop and communicate understanding of high priority issues so that smart decisions can be made and implemented during crises in the case of Colombia. After 60 years of war confrontation (civil society, guerrilla, paramilitary) we are preparing toward a post-conflict situation; for labor re-qualification of thousands of victims a new education model based on integrating architectures and knowledge systems is proposed. The post-agreement implies greater social investment especially in education, towards the reconstruction of Peace and Equity that goes beyond social mobility (e.g. employment) with new educational models based on high quality and decentralization. Nowadays the Government of Colombia (GoC) signed an Agreement with the guerilla FARC after 6 years of talks. In the following days the Peace Nobel Prize was granted to the GoC President, Juan M. Santos. The following days new dialogues, with the minor and remaining guerilla ELN, was announced for starting soon in Ecuador. If succeed, the total peace will be warranted. The new educational model, involves: • Individual monitoring and evaluation, • guided by ICT (information and communicationstechnologies), • competencies (supported by KE) • asynchronous methodolyg, • personal tutoring: teaching/automated online (includingmobile devices usage), • for the population of young and adult, victims of armedconflicts, • for people preparation for the IV Industrial Revolution,and to face the transition to the Digital Transformation(to radically improve performance of institutions) Regarding the social situation, in our side we are preparing for a post-conflict situation; we have to prepare thousands of demobilized people and victims, requiring labor re-qualification. In addition, given the deficit of 100,000 ICT Engineers, and 300,000 Technologist (T) and Professional Technicians (PT), e.g. programmers; our proposal is intended as a disruptive innovation to address the post-war digital divide, and this country has based human talent mental rehabilitation, with training and labor requalification. We integrated our own experiences and proposed a new education model, based on the integration into an Intelligent Management Information System (iMIS), of 5 architectures that we previously have implemented in several higher education Institutions (HEI) in Colombia. Those architectures, supported by the convergence of Information, Software, and KE, with Artificial & Computational Intelligence, and guided by mathematical and computational models. iMIS integrates hybrid multilevel architectures with multilevel systems, in order to respond to the solution of HE-ME (middle education) problems, leading to face competitiveness and productivity, observing specifically how to include these technologies for evolving the university into modernity, bringing together the institution governability, the student and teacher productivity, and the High Quality Education (HQE). The paper characterizes an intelligent educational organization of the III millennium, defines post-conflict crises, and discusses a competency-based educational model as part of the alternatives to confront the national crisis with an educational crisis management framework. We are trying to consolidate numerous experiential learnings related to the complexity of HE such as student dropout, educational quality, productivity and competitiveness in an underdeveloped country like Colombia. Finally, the model includes the use of architectural tools already implemented. © 2017 Latin American and Caribbean Consortium of Engineering Institutions. All rights reserved.",2017
A proposal for a technological surveillance unit aimed at regional competitiveness,Journal of Engineering and Applied Sciences,"Knowing and monitoring the market environment and global technological trends can contribute to better decision making in competitive intelligence. This research proposes the design of a technological surveillance unit for the construction materials sector of the department of Sucre, Colombia, through the identification of technological gaps and reference models. The research was developed methodologically through the development of a theoretical framework for reviewing scientific literature, diagnosis and identification of technological gaps in the sector and subsectors through semi-structured interviews and direct observation, the design of the surveillance unit through the needs captured from the sector and a proposal of structure and governance for the actors involved in the process. An intentional sample of 21 companies from the different subsectors of the construction materials sector was taken, revealing as results technological gaps in each of them and absence of R&D& I processes in most organizations. © Medwell journals, 2017.",2017
The associated and non-associated MSMEs: An approach to its management in innovation and technological development [MiPyMEs asociadas y no asociadas: Una aproximación a su gestión en innovación y desarrollo tecnológico],Espacios,"This study is correlational, field, we analyzed the performance of inclusion, innovation, application of technology and the use of technological tools in Santiago de Cali, Colombia between affiliated companies and those not affiliated to the Colombian Association of Micro, Small and Medium Enterprises With a random sample of 85 companies registered in the Chamber of Commerce of Cali and one of 69 Mipymes associated to Acopi; A questionnaire was applied whose data were analyzed through the SPSS program 22. © 2017.",2017
